,Synonyms,Japanese,English,German,Spanish,French,Type,Episodes,Status,Aired,Premiered,Broadcast,Producers,Licensors,Studios,Source,Genres,Theme,Demographic,Duration,Rating,Score,Ranked,Popularity,Members,Favorites,Scorers,Synopsis,Related_Entries,Title,Themes,Genre,Demographics
128,Beyblade Burst Super King,ベイブレードバースト スパーキング,Beyblade Burst Surge,,,,['ONA'],52,Finished Airing,"Apr 3, 2020 to Mar 19, 2021",,,['ADK Emotions'],['ADK Emotions NY Inc.'],['OLM'],['Manga'],"['Action', 'Adventure', 'Sci-Fi']",,['Kids'],12 min. per ep.,PG - Children,6.65,#6172,#7427,"7,782",45,3799,"One year after the events of Beyblade Burst GT, brothers Hikaru, and Hyuga witness the power of Superking/Sparking evolutions of Valkyrie, Ragnaruk, and Satan. The three beys radiate a power that was not even dreamable, due to their bladers pulling off a sparking launch. Hyuga and Hikaru get inspired to make their own sparking beys, Hyperion and Helios, and compete with the legendary bladers, training to best the top ranked bladers to ever touch the stadium. Prepared to do whatever it takes to become the best, they head across the globe to challenge the best to ever let it rip, in an effort to become stronger, and battle all of the top bladers that were able to make their mark in the stadium. (Source: Wikipedia)","['Prequel (TV) Beyblade Burst Gachi', 'Sequel (ONA) Beyblade Burst Dynamite Battle']",Beyblade Burst Sparking,,,
129,"Pokétoon, Zuruggu to Mimikkyu - Chase the Beans, Hero ni Naritai Yanchamu, Yume no Tsubomi, Mattete ne! Koiking, Gengar ni Nacchatta!?, Pokapoka Magumaggu House",POKÉTOON,Pokétoon,,,,['ONA'],8,Finished Airing,"Jun 4, 2020 to Dec 28, 2021",,,"['Nintendo', 'Creatures Inc.']","None found,","['Magic Bus', 'Studio Colorido', 'DandeLion Animation Studio', 'Studio GOONEYS', 'Pancake', 'Mimoid', 'team Yamahitsuji']",Game,"['Adventure', 'Comedy']",,['Kids'],8 min. per ep.,G - All Ages,7.30,#2820,#7479,"7,666",19,3574,"Animations released on Pokémon Kids TV Japan YouTube channel. Episodes: #1: Zuruggu to Mimikkyu - Chase the Beans (ズルッグとミミッキュ), animated by Dandelion Animation Studio, released June 4, 2020. #2: Hero ni Naritai Yanchamu (ヒーローになりたいヤンチャム), animated by Pancakes, released May 5, 2021. #3: Yume no Tsubomi (ユメノツボミ), animated by Studio Colorido, released June 6, 2021. #4: Mattete ne! Koiking (まっててね！コイキング), animated by Studio Colorido, released July 2, 2021. #5: Pokapoka Magumaggu House (ぽかぽかマグマッグハウス), animated by Studio Colorido, released August 5, 2021. #6: Gengar ni Nacchatta!? (ゲンガーになっちゃった！？), animated by Studio Colorido, released September 10, 2021. #7: Fubuki no Natsu Yasumi (ふぶきのなつやすみ), animated by Mimoid, released October 8, 2021. #8: Purin no Uta (プリンのうた), animated by StudioGOONEYS, released December 28, 2021.","['Sequel (ONA) Poketoon (2024)', '']",Poketoon,,,
130,"Yao Shen Ji: Hei Yu Pian, Tales of Demons and Gods 4th Season",妖神记之黑狱篇,,,,,['ONA'],52,Finished Airing,"Apr 8, 2020 to Sep 27, 2020",,,['bilibili'],"None found,",['Ruo Hong Culture'],Novel,"['Action', 'Adventure', 'Fantasy', 'Romance']",,,8 min. per ep.,PG-13 - Teens 13 or older,7.41,#2341,#7681,"7,183",31,3060,Fourth season of Yao Shen Ji.,"['Prequel (ONA) Yao Shen Ji 3rd Season', 'Sequel (ONA) Yao Shen Ji 5th Season']",Yao Shen Ji 4th Season,"['Martial Arts', 'Mythology']",,
131,"Dalisi Rizhi, The Journal of Dali Temple",大理寺日志,White Cat Legend,,,,['ONA'],12,Finished Airing,"Apr 10, 2020 to Jul 3, 2020",,,['bilibili'],"None found,","['Nice Boat Animation', 'Ai Si Animation Studio']",['Web manga'],"['Action', 'Comedy', 'Mystery']",,,20 min. per ep.,PG-13 - Teens 13 or older,6.97,#4525,#8087,"6,328",29,1365,"Chen Shi, a young man from the countryside, journeys to Luoyang in search of his missing older brother, whose existence he only knew about upon his mother’s death. He knows neither the name nor face of his brother, and after finally arriving at Luoyang, he runs out of money as well. One thing led to another, and he finds himself employed at Dali Court, where he works for Vice Minister Li Bing, a large white cat. White Cat Legend is a historical show that tells the daily life of the Dali Court officials under Empress Wu Mingkong’s rule.","['Sequel (ONA) Da Li Si Rizhi 2nd Season', '']",Da Li Si Rizhi,"['Anthropomorphic', 'Historical', 'Martial Arts', 'Mythology']",,
132,Let's Learn With Katarina,カタリナと学ぼう,,,,,['ONA'],9,Finished Airing,"May 10, 2020 to Jul 7, 2020",,,['Grooove'],"None found,",['AQUA ARIS'],['Light novel'],,,,44 sec. per ep.,PG-13 - Teens 13 or older,5.63,#11667,#8189,"6,128",3,1288,Short specials posted on the official Twitter account focused on main cast of Otome Game no Hametsu Flag shika Nai Akuyaku Reijou ni Tensei shiteshimatta...,[],Katarina to Manabou,,['Comedy'],
133,Tatami-chan the Guest Room Spirit,ざしきわらしのタタミちゃん,The House Spirit Tatami-chan,The House Spirit Tatami-chan,The House Spirit Tatami-chan,The House Spirit Tatami-chan,['ONA'],12,Finished Airing,"Apr 10, 2020 to Jun 26, 2020",,,"None found,","None found,",['Zero-G'],Original,"['Comedy', 'Horror', 'Supernatural']",,,4 min. per ep.,PG-13 - Teens 13 or older,5.23,#12822,#8473,"5,694",3,2521,"The ""pleasant horror gag comedy"" centers around the life of Tatami-chan, a sardonic ghost from Iwate Prefecture who is now living in Tokyo among other spirits, supernatural entities, and humans. In addition to dealing with otherworldly matters, the unemployed Tatami-chan also has to deal with job-hunting as well as paying for gas, water, and electricity. (Source: ANN)",[],Zashiki Warashi no Tatami-chan,,,
134,我才不是恶毒女配,麻辣女配,Spicy Girl,,,,['ONA'],32,Finished Airing,"Apr 7, 2020 to Jul 18, 2020",,,['Tencent Penguin Pictures'],"None found,","None found,",['Manga'],"['Comedy', 'Romance']",,,8 min. per ep.,PG-13 - Teens 13 or older,6.97,#4500,#8644,"5,408",25,1304,"Since her childhood, Su Xiao has been sidelined because of her frightening air. Now an actress, she unfortunately remains stuck in the roles of villains. One day, Xiao Jian , a recognized investor and actor, comes across a scene between Su Xiao and his manager, which is confusing. In order to silence him, Su Xiao signs a contract with him. (Source: Nautiljon)",[],Ma La Nu Pei,,,
135,"God of Deception, Liar God",嗜谎之神,,,,,['ONA'],13,Finished Airing,"Apr 1, 2020 to Jun 10, 2020",,,['bilibili'],"None found,",['Haoliners Animation League'],['Web manga'],"['Action', 'Comedy']",,,20 min. per ep.,PG-13 - Teens 13 or older,6.30,#8302,#8721,"5,270",10,861,"Lian En is a god who has lied too much and has now attracted bad karma. One day, he meets a high school student who will change his destiny forever! (Source: Exodus Chaos)","['Adaptation (Manhua) Shi Huang Zhi Shen', '']",Shi Huang Zhi Shen,,,
136,Sefure Gakuen,セフレ学園,,,,,['ONA'],1,Finished Airing,"Apr 30, 2020",,,['Mousou Jitsugen Media'],"None found,","None found,",['Manga'],,,,20 min.,Rx - Hentai,5.41,N/A,#8875,"5,037",18,1926,"Takeshi Ookubo is a student at the prestigious Seifuukan Academy, attended mostly by the rich and influential. Owing to his nasty physique and meager intellect, he has little prospect in getting the attention of, let alone developing a romantic relationship with, the woman of his dreams. When Takeshi is on the verge of giving up, God bestows upon him hypnosis powers, which Takeshi uses to seduce the attractive girls at his school and build his own harem. He now embarks on a perverted quest, entrapping both classmates and teachers alike under his command. The academy soon transforms into his exclusive sexual playground as more and more girls begin submitting to his influence. [Written by MAL Rewrite]",[],Sexfriend Gakuen,,['Hentai'],
137,"Xing Chen Bian 2nd Season, Xingchen Bian Season 2nd Season, Legend of Immortals 2nd Season, Stellar Transformation 2nd Season",星辰变 羽立沧海,,,,,['ONA'],12,Finished Airing,"May 3, 2020 to May 31, 2020",,,"['Tencent Penguin Pictures', 'China Literature Limited', 'Pure Arts']","None found,",['Foch Film'],Web novel,"['Action', 'Adventure', 'Fantasy', 'Romance']",,,26 min. per ep.,PG-13 - Teens 13 or older,7.37,#2479,#8897,"4,998",17,2262,"Believing Qin Yu to be dead, his family sets out to avenge him; elsewhere, Qin Yu and Xiao Hei find themselves in an unfamiliar place. While adjusting to this new environment, they encounter a talking cat, which gives him a book with the answers to all his questions. With this book, he learns of Stellar Transformation, a mysterious cultivation method often mentioned in stories to children. Using this newfound technique, Qin Yu and Xiao Hei set out to the Boundless Ocean to further cultivate. Though their journey is not smooth, they gain new allies and reach new heights. [Written by MAL Rewrite]","['Prequel (ONA) Xingchen Bian', 'Sequel (ONA) Xingchen Bian: Xingchen Yao Hai']",Xingchen Bian: Yu Li Cang Hai,"['Historical', 'Martial Arts']",,
138,Supreme God Emperor,无上神帝,,,,,['ONA'],64,Finished Airing,"May 18, 2020 to Dec 18, 2020",,,"['Tencent Penguin Pictures', 'iQIYI']","None found,",['Ruo Hong Culture'],Novel,"['Action', 'Adventure', 'Supernatural']",,,7 min. per ep.,PG-13 - Teens 13 or older,7.27,#2993,#9566,"3,993",30,1485,"Ten thousand years ago, the immortal king Muyun was conspired by others for holding the Zhu Xiantu. After ten thousand years of sleep, his remnant soul awakened on the famous ""Trash Muyun"" of the Southern Cloud Empire of the Heavenly Fate continent. (Source: LM ANIME)","['Sequel (ONA) Wu Shang Shen Di 2nd Season', '']",Wu Shang Shen Di,,,
139,"Huang Li Shi, Chinese Almanac Master, Secret Archives of Unscientific Materialism, 不科学唯物主义秘密档案, 黄历师",历师,Almanac Master,,,,['ONA'],16,Finished Airing,"May 7, 2020 to Aug 13, 2020",,,['Tencent Penguin Pictures'],"None found,",['B.CMAY PICTURES'],Novel,"['Action', 'Mystery', 'Supernatural']",,,23 min. per ep.,PG-13 - Teens 13 or older,6.32,#8166,#9684,"3,866",9,451,"Huangli Shi, according to legends, refers to a Fangshi who can alter the effects of seasonal solstices, solar terms, and festivals, and is able to predict each day's fortune. Xiao Nanzhu, an unemployed young man, decided to take on his usual job that has been passed down for generations, after being inspired by his childhood friend. Now he just wants to call 110. Chuxi: What are you looking at? You don't want to live past new year's eve? Chuba: Today's fortune is terrible, nothing's going to turn out right. I'm afraid there might be a… bloody disaster.",[],Li Shi,,,
140,,我开动物园那些年,Those Years I Opened a Zoo,,,,['ONA'],13,Finished Airing,"Apr 5, 2020 to Jun 21, 2020",,,['bilibili'],"None found,",['Haoliners Animation League'],Novel,"['Comedy', 'Slice of Life']",,,14 min. per ep.,PG-13 - Teens 13 or older,6.68,#6004,#9682,"3,869",14,852,"Duan Jiaze inherited a private zoo and was forced to sign a contract after his graduation. And from that day onwards the first ever age classified Luya zoo appeared, those aged under 21 are prohibited to enter. (Source: Twitter User Xiyoumiyu)",[],Wo Kai Dongwuyuan Naxie Nian,,,
141,One Step Toward Freedom,独步逍遥,,,,,['ONA'],480,Finished Airing,"Jun 18, 2020 to Dec 6, 2024",,,"None found,","None found,",['Suoyi Technology'],Novel,,['Martial Arts'],,12 min. per ep.,PG-13 - Teens 13 or older,7.05,#4126,#9881,"3,621",24,880,"The universe is vast, producing countless types of life forms. These life forms form all kinds of souls. All races and spirits have different races and different beliefs, but the same is the extravagant hope for Taoism. Any living beings are dusted with Dao heart, they are not willing to do this, they become powerful and even live forever by enlightening Dao through practice. The Avenue of Heaven and Earth is like luck, where the able live. The road to the great road is the road to struggle for the road, which has caused the struggle of all races and souls. An era can only support a few people to gain the Tao. Those who have attained the Tao think that standing on the top of the world, they can be free in the future. But I found that even Dao. It’s also hard to escape bad luck. There is a ruler above them, harvesting one era after another, and the cultivators of the world want to maintain their ambitions. Ten thousand races and all spirits are just nourished by these rulers. These masters harvest the Taoists, harvest the spirituality of each world, and destroy one by one. The Taoists in the past were unwilling to be reaped and resisted constantly, but failed every time. Until… the protagonist Ye Yu appeared, he peeled away one time and one secret. As he unfolded an epic picture scroll, in this magnificent world, he continued to grow, experience love and friendship, cleanse the dusted Taoist heart, and finally confront the master who harvests all races. (Source: v.qq.com)",[],Dubu Xiaoyao,,['Action'],
142,,峰岸さんは大津くんに食べさせたい,,,,,['ONA'],4,Finished Airing,"May 22, 2020 to Jun 12, 2020",,,['Bit Promotion'],"None found,",['AQUA ARIS'],['Web manga'],"['Boys Love', 'Slice of Life']",,,1 min. per ep.,PG-13 - Teens 13 or older,6.14,#9179,#10449,"3,043",1,1129,"Salaryman Ootsu is frustrated by the fact that his coworker Minegishi is flawless in every way. Minegishi is not only an exquisite and amiable man, but he also thrives at work—simply put, he is the ideal man! However, Minegishi finds his innermost happiness by feeding Ootsu tasty meals. In his daily attempts to fill both his coworker's stomach and heart, Minegishi concocts various schemes to lure Ootsu into eating with delight. [Written by MAL Rewrite]","['Adaptation (Manga) Minegishi-san wa Ootsu-kun ni Tabesasetai', '']",Minegishi-san wa Ootsu-kun ni Tabesasetai,"['Adult Cast', 'Workplace']",,
143,"Fox Spirit Matchmaker 9th Season, Little Foxspirit Matchmaker Season 9, Enmusubi no Youko-chan",狐妖小红娘 金晨曦,,,,,['ONA'],10,Finished Airing,"Jun 19, 2020 to Aug 14, 2020",,,"None found,","None found,","['Haoliners Animation League', 'Garden Culture']",['Manga'],"['Comedy', 'Drama', 'Romance', 'Supernatural']",['Historical'],,18 min. per ep.,PG-13 - Teens 13 or older,7.03,#4273,#10457,"3,036",4,788,The 9th season of Huyao Xiao Hongniang.,"['Prequel (ONA) Huyao Xiao Hongniang: Wei Sheng', 'Sequel (ONA) Huyao Xiao Hongniang: Mu Tiancheng', 'Adaptation (Manhua) Xiangsishu Xia', '']",Huyao Xiao Hongniang: Jin Chenxi,,,
144,"Arad: Gyakuten no Wa, Arad: Reversal of Fate, Arad: Nizhuan Zhi Lun, アラド：逆転の輪",地下城与勇士·逆转之轮,,,,,['ONA'],12,Finished Airing,"Apr 23, 2020 to Jul 23, 2020",,,"['Tencent Animation & Comics', 'Tencent Games', 'Friendly Land', 'Stray Cats']","None found,",['LIDENFILMS'],Game,"['Action', 'Adventure', 'Comedy', 'Fantasy']",,,24 min. per ep.,PG-13 - Teens 13 or older,6.03,#9748,#10973,"2,599",13,208,Sequel to Arad: Suming Zhi Men.,"['Prequel (ONA) Arad: Suming Zhi Men', 'Prequel (ONA) Dixia Cheng Yu Yongshi: Nizhuan Zhi Lun Episode 0']",Dixia Cheng Yu Yongshi: Nizhuan Zhi Lun,,,
145,,コンドームバトラー ゴロー,,,,,['ONA'],4,Finished Airing,"Jun 11, 2020",,,"None found,","None found,","None found,",Original,,['Parody'],,57 sec. per ep.,PG-13 - Teens 13 or older,6.62,#6378,#11022,"2,561",14,1498,"The show follows Gorou, a 24-year-old man who dreams of becoming the greatest Condom Battler. His go-to weapon is a 0.01 mm condom which he loads into an arm dispenser, and it opens to reveal a red rubbery armor that Gorou wears in battle. It also gives the hero the ability to summon sperm and created an attack out of the sticky substance. There are other characters in the anime like Miku and Hayato who duel using their own condoms. The anime is filled with absurd dialogue and fights, but these heroes always make sure to teach a sex education lesson along the way. (Source: Comicbook.com)","['Sequel (ONA) Condom Battler Gorou: Revive', '']",Condom Battler Gorou,,['Action'],
146,,彼女、お借りします デートムービー,Rent-a-Girlfriend: Date Movie,,,,['ONA'],32,Finished Airing,"Jun 13, 2020 to Oct 6, 2020",,,"None found,","None found,",['AQUA ARIS'],['Manga'],,,,1 min. per ep.,PG-13 - Teens 13 or older,5.76,#11095,#11278,"2,377",5,639,"Date movie shorts posted on the official Twitter account and later included on Blu-ray volumes of Kanojo, Okarishimasu.",[],"Kanojo, Okarishimasu: Date Movie",,['Romance'],
147,,乙女ゲームの破滅フラグしかない悪役令嬢に転生してしまった… ボイスドラマ,,,,,['ONA'],7,Finished Airing,"Apr 5, 2020 to Apr 24, 2020",,,"None found,","None found,",['SILVER LINK.'],['Light novel'],"['Comedy', 'Fantasy']",['School'],['Shoujo'],2 min. per ep.,PG-13 - Teens 13 or older,6.31,#8192,#11537,"2,205",2,720,Recap voice dramas of main characters posted online and later included in Blu-ray volume 2 of main series.,[],Otome Game no Hametsu Flag shika Nai Akuyaku Reijou ni Tensei shiteshimatta... Voice Drama,,,
148,"Wanjie Chunqiu, Wan Jie Chunqiu",万界春秋,Spring and Autumn,,,,['ONA'],56,Finished Airing,"Apr 13, 2020 to Oct 15, 2020",,,['Tencent Penguin Pictures'],"None found,",['Ruo Hong Culture'],Original,"['Action', 'Adventure', 'Fantasy', 'Romance']",,,8 min. per ep.,PG-13 - Teens 13 or older,6.39,#7759,#11632,"2,141",10,591,"Ye Chen, who is an ancient god, has fallen from the world of the gods to the world of the blue world. Here, hundreds of thousands of countries are standing, and the heroes are fighting for hegemony. Ye Chen has been in this pale blue world for hundreds of years and has established a huge force. In Baizhou Qianguo, the existence of Ye Chen has always been a legend. But the power from the world of the gods slowly extended to the blue world, and a cruel dragon battle is about to begin. In the capital city of Nanzhou, the first battle of Tianbei State, Hong Xu and the Wulong two men of Nanzhou Shuangyuemen Gate competed outside the Huashen Palace, but they were defeated in the hands of Su Xiaoxiao, the group leader of the Huashen Palace. The Northern Army emerged in the eastern part of southern South China and wanted to break South. The defender will disregard the safety of the people of Nanzhou and the hurricane, and intends to open the city gate to surrender (Source: Narul Donghua)",[],Wan Jie Chun Qiu,"['Historical', 'Martial Arts']",,
149,,望古神话之天选者,METAMAN,,,,['ONA'],12,Finished Airing,"Apr 7, 2020 to Jun 16, 2020",,,['bilibili'],"None found,",['Chongzhuo Animation'],Original,"['Action', 'Sci-Fi']",,,20 min. per ep.,PG-13 - Teens 13 or older,6.03,#9786,#12379,"1,678",4,278,"In the year 2115 of the Fortress, Wei Qin, commander of the border troops, went to the Fortress to participate in the selection of the elected official and to secretly investigate those responsible for the Border incident. At the same time, the No. 1 public enemy, Yuan Yi, launched a major revolt. As the plot progresses, all parties are involved in this quest. How is Wei Qin going to sort out the true from the false and bring the truth out? (Source: Exodus Chaos)",[],Wang Gu Shenhua Zhi Tian Xuanzhe,,,
150,"Chief Soul Manipulator, Chief Soul Master",首席御灵师,,,,,['ONA'],40,Finished Airing,"Jun 20, 2020 to Oct 24, 2020",,,"None found,","None found,",['Suoyi Technology'],Original,"['Action', 'Fantasy']",,,11 min. per ep.,PG-13 - Teens 13 or older,6.48,#7218,#12490,"1,623",8,417,"Last century, Shi Dali was sealed for 100 years, but he accidentally discovered Qingqing, the celestial nine tails fox. He started his path to become Chief Soul Master, to find out the mistery of his origin and to protect the world. (Source: themoviedb)","['Sequel (ONA) Shouxi Yu Ling Shi 2', '']",Shouxi Yu Ling Shi,,,
151,,『RabbiTube』クリエイターにチャレンジ！,,,,,['ONA'],16,Finished Airing,"Jan 24, 2020 to Dec 5, 2021",,,['Bandai Namco Online'],"None found,",['DandeLion Animation Studio'],Game,,['Idols (Male)'],,9 min. per ep.,G - All Ages,7.13,#3777,#12564,"1,579",10,504,Short videos are released each month on YouTube to celebrate the character's birthdays.,[],RabbiTube: Creator ni Challenge!,,['Comedy'],
152,,Girl X,The Girl and the Monster,,,,['ONA'],5,Finished Airing,"Jul 26, 2019 to Dec 2, 2021",,,"None found,","None found,","None found,",Original,"['Comedy', 'Horror']",,,1 min. per ep.,PG-13 - Teens 13 or older,5.13,#13001,#13174,"1,321",0,748,"A woman is relaxing at home, where she is joined by a peculiar blue creature. Initially terrified, she quickly grows fond of it, and the two form a bond. However, it would be wise of her not to let her guard down just yet. [Written by MAL Rewrite]",[],Girl X,,,
153,Syupeo Sikeulis,슈퍼 시크릿,Super Secret,,,,['ONA'],22,Finished Airing,"May 30, 2020 to Feb 21, 2021",,,['Laftel'],"None found,",['Studio Shelter'],['Web manga'],"['Comedy', 'Romance', 'Supernatural']",,,8 min. per ep.,PG-13 - Teens 13 or older,6.72,#5793,#13509,"1,206",2,269,"Two neighboring childhood friends. An airheaded girl and the boy who takes care of her like a mother hen. And of course, there is his family background with a tiny, insignificant supernatural secret. Now that her parents have left the girl in their neighbor's care, will she ever discover her friend's secret? (Source: MU)","['Adaptation (Manhwa) Super Secret', '']",Super Secret,,,
154,"Journey to the West, Westbound, Westbound Discipline",西行纪之再见悟空,The Westward: Goodbye Wu Kong,,,,['ONA'],1,Finished Airing,"May 4, 2020",,,['Tencent Penguin Pictures'],"None found,",['BYMENT'],['Manga'],"['Action', 'Adventure', 'Fantasy']",,,1 hr. 5 min.,PG-13 - Teens 13 or older,6.90,#4850,#13842,"1,094",3,343,"Prequel to animation series ""Journey to the West"", Su Yi, a princess of the heavenly realm, befriends Sun Wukong in the mortal world and falls in love with him. However, Sun Wukong is violently treated as a demon by other gods and suppressed under the Five Fingers Mountain. In the past 300 years, the god Rulai has taught the Wukong how to uphold justice in his heart. Sun Wukong protects the Longevity Monk and goes to the other side of the world to retrieve the fire of creation for the benefit of the world, but finally returns after many ups and downs. The conspiracy surfaced and the fate of the master and disciples was rewritten. (Source: TMDB)","['Sequel (ONA) Xi Xing Ji', 'Adaptation (Manhua) Xi Xing Ji']",Xi Xing Ji: Zaijian Wu Kong,"['Historical', 'Martial Arts']",,
155,"Shenme Gui Part 3, Non-human Part 3",非人哉 第三季,,,,,['ONA'],12,Finished Airing,"Jun 17, 2020 to Aug 26, 2020",,,['Tencent Penguin Pictures'],"None found,",['Fenz'],['Manga'],"['Comedy', 'Supernatural']",['Mythology'],,6 min. per ep.,PG-13 - Teens 13 or older,7.09,#3971,#13906,"1,076",1,377,Part three of first season of Fei Ren Zai.,"['Prequel (ONA) Fei Ren Zai Part 2', 'Sequel (ONA) Fei Ren Zai Part 4', 'Adaptation (Manhua) Fei Ren Zai', '']",Fei Ren Zai Part 3,,,
156,Phantasy Star Online 2 Comic: Okawari,ぷそ煮コミおかわり,Puso Ni Comi: Okawari,,,,['ONA'],26,Finished Airing,"Apr 7, 2020 to Sep 29, 2020",,,['Sega'],"None found,",['Point Pictures'],['Web manga'],,,,4 min. per ep.,PG-13 - Teens 13 or older,6.45,#7413,#13970,"1,062",0,251,"A second season of Puso Ni Comi, once again following the in-game avatars of the cast.","['Prequel (ONA) Puso Ni Comi', 'Adaptation (Manga) Phantasy Star Online 2: Puso Ni Comi']",Puso Ni Comi: Okawari,"['Parody', 'Video Game']",['Comedy'],
157,"Different World Medicine Shop, The Pharmacy of the Other World",异世界中药铺,,,,,['ONA'],40,Finished Airing,"May 8, 2020 to Sep 11, 2020",,,"['Tencent Penguin Pictures', 'iQIYI']","None found,",['Suoyi Technology'],['Manga'],"['Drama', 'Fantasy']",,,10 min. per ep.,PG-13 - Teens 13 or older,6.07,#9567,#14043,"1,042",2,348,"After graduating from the University of Traditional Chinese Medicine, Sun Jiayou returned home to inherit a traditional Chinese medicine shop. He found that although the people here would not use medicine as a treatment, they had own spiritual system. To realize his grandfather’s dream, he plans to promote Chinese medicine in a different world. However, the spirit messenger considers it a big threat. In some confrontations with the spirit messenger, he discovers a greater mystery.","['Sequel (ONA) Yi Shijie Zhongyao Pu 2nd Season', '']",Yi Shijie Zhongyao Pu,,,
158,"Wu Xian Shao Nu 48: Infinite, INFINITE SNH48",无限少女48,,,,,['ONA'],12,Finished Airing,"Apr 8, 2020 to Jun 17, 2020",,,['Tencent Penguin Pictures'],"None found,",['Seven Stone Entertainment'],Original,,,,18 min. per ep.,PG - Children,6.77,#5469,#14059,"1,039",3,186,"The story takes place in 2047. We follow the story of several young girls, each coming from different dimensions. All of them want to join the new project group 48. (Source: Nautiljon)",[],Wuxian Shaonu 48,"['Idols (Female)', 'Music']",['Fantasy'],
159,"Everlasting Immortal Firmament 4th Season, Ancient Celestial Firmament 4th Season, Ancient Divine Pinnacle 4th Season, Wangu Xian Qiong 4th Season, 万古仙穹 第四季",万古仙穹 Ⅳ 银月城篇,,,,,['ONA'],12,Finished Airing,"Apr 16, 2020 to Jul 2, 2020",,,['iQIYI'],"None found,",['ASK Animation Studio'],Novel,"['Action', 'Adventure', 'Fantasy']",,,16 min. per ep.,PG-13 - Teens 13 or older,6.16,#9039,#14258,982,2,148,Fourth season of Wangu Xian Qiong.,"['Prequel (ONA) Wangu Xian Qiong III: Eren Gu Pian', '']",Wangu Xian Qiong IV: Yin Yue Cheng Pian,,,
