,Synonyms,Japanese,English,German,Spanish,French,Type,Episodes,Status,Aired,Premiered,Broadcast,Producers,Licensors,Studios,Source,Genres,Theme,Demographic,Duration,Rating,Score,Ranked,Popularity,Members,Favorites,Scorers,Synopsis,Related_Entries,Title,Genre,Themes,Demographics
185,,CONNECTED…,,,,,['ONA'],1,Finished Airing,"Dec 6, 2020",,,"None found,","None found,","['Production I.G', 'monofilmo']",Original,,,,2 min.,PG-13 - Teens 13 or older,5.17,#12944,#15557,679,1,292,"A collaboration of Mamoru Oshii, Koji Morimoto, and KENWOOD, Connected... a promotional video for the KENWOOD wearable device with voice assistant ""WS-A1"" ""WS-A1G."" The short animation depicts future life with a unique interpretation and set in a fictitious city where devices have become commonplace. (Source: YouTube, edited)",[],Connected...,['Sci-Fi'],,
186,Punishing: Panini,战双帕尼尼,Panini: Gray Raven,,,,['ONA'],12,Finished Airing,"Oct 27, 2020 to Jan 12, 2021",,,"None found,","None found,",['Big Firebird Culture'],Game,"['Action', 'Comedy']",,,6 min. per ep.,PG-13 - Teens 13 or older,6.67,#6085,#15552,680,10,206,"Based on the video game ""Punishing: Gray Raven.""",[],Zhan Shuang Panini,,,
187,,剑网3·侠肝义胆沈剑心之长漂,JX Online 3: The Adventure of Shen Jianxin in Chang'an,,,,['ONA'],20,Finished Airing,"Oct 24, 2020 to Feb 27, 2021",,,"['bilibili', 'Seasun Pictures']","None found,",['Shengying Animation'],Original,,['Historical'],,5 min. per ep.,PG-13 - Teens 13 or older,[],#16328,#15785,643,1,,No synopsis information has been added to this title. Help improve our database by adding a synopsis here.,[],Jian Wang 3: Xia Gan Yi Dan Shen Jianxin Zhi Chang Piao,['Comedy'],,
188,Onepato,おねがいっパトロンさま！,Dear My Patron,,,,['ONA'],10,Finished Airing,"Oct 18, 2020 to Jun 19, 2022",,,"['Happinet', 'Bit grooove promotion']","None found,",['TANOsim'],Original,,,,26 min. per ep.,PG-13 - Teens 13 or older,[],#18205,#15805,639,3,,"The story centers on hero pair teams named ""Patraisers,"" consisting of ""Sugars"" and their supporter ""Patrons."" The Patraiser teams ""reinvigorate people's frozen hearts."" The ""main story"" videos will focus on a single Patraiser pair, consisting of the Sugar Asahi Yuga and his Patron Ryouya Nekoyashiki. The ""side story"" videos will focus on their daily lives, as well as the other characters. (Source: ANN)","['Sequel (ONA) Onegai Patron-sama! Episode 0', '']",Onegai Patron-sama!,['Slice of Life'],,
189,,九夜神传,Legend of Nine Nights,,,,['ONA'],13,Finished Airing,"Dec 21, 2020 to Mar 8, 2021",,,"None found,","None found,",['Yi Chen Animation'],Original,"['Action', 'Adventure', 'Fantasy']",,,21 min. per ep.,None,[],#16463,#15933,618,3,,No synopsis information has been added to this title. Help improve our database by adding a synopsis here.,[],Jiu Ye Shen Chuan,,"['Historical', 'Martial Arts']",
190,,タイバン!,Tiny² Band Story,,,,['ONA'],7,Finished Airing,"Dec 31, 2020 to May 10, 2021",,,['Brave group'],"None found,","None found,",Original,,,,25 min. per ep.,PG-13 - Teens 13 or older,[],#14551,#15957,615,1,,"Mizuki Haruno, who has been spending her days feeling blue, was taken to a live concert by her childhood friend, Nozomi. She caught a glimpse of the ""exciting world there."" ""Nozomi...I want to play in a girls' band!"" The story of Mizuki who became a high-school student begins now! This is a rockin' youth story woven by the four individual girls from the music band at Hakumai High School in a town in Hokkaido! (Source: Taiban! Official YouTube channel, edited)",[],Taiban!,,"['Music', 'School']",
191,Tsukiuta. The Animation 2 Omake,ツキウサ。劇場,,,,,['ONA'],12,Finished Airing,"Oct 7, 2020 to Dec 23, 2020",,,"None found,","None found,","None found,",Other,,,,52 sec. per ep.,PG-13 - Teens 13 or older,[],#14890,#16530,544,1,,Omake mini anime released after each episode of Tsukiuta. The Animation 2 on the Tsukino Production official YouTube channel.,[],Tsukiusa. Gekijou,['Comedy'],,
192,Painting the Rails of Rivers and Lakes at Night,画江湖之轨夜行,Power Racer,,,,['ONA'],40,Finished Airing,"Nov 10, 2020 to Apr 19, 2022",,,"None found,","None found,",['Rocen'],Original,,['Racing'],,20 min. per ep.,PG-13 - Teens 13 or older,[],#21208,#16770,516,1,,"This is a story about growth, friendship and passion. Through the continuous improvement of racing skills, the in-depth understanding of the concept of racing, the understanding of the meaning of life and the friendship of friends, the originally ambitious racer Yeji Dong has gradually grown into the most reliable partner, and will gradually grow into the most powerful racer... (Source: V2Anime)",[],Hua Jianghu: Gui Yexing,['Action'],,
193,,ただいま！ちびゴジラ シーズン２,"I'm Home, Chibigodzilla 2nd Season",,,,['ONA'],13,Finished Airing,"Dec 2, 2020 to Feb 24, 2021",,,"None found,","None found,","None found,",Original,"['Fantasy', 'Slice of Life']",,,30 sec. per ep.,G - All Ages,5.69,#11389,#16759,518,0,202,Second season of Tadaima! Chibi Godzilla.,"['Prequel (ONA) Tadaima! Chibi Godzilla', '']",Tadaima! Chibi Godzilla Season 2,,,
194,,书灵记 第二季,,,,,['ONA'],40,Finished Airing,"Oct 28, 2020 to Mar 3, 2021",,,"None found,","None found,","None found,",Web novel,,['Martial Arts'],,11 min. per ep.,None,[],#14206,#16952,498,0,,No synopsis information has been added to this title. Help improve our database by adding a synopsis here.,"['Prequel (ONA) Shu Ling Ji', 'Sequel (ONA) Shu Ling Ji 3']",Shu Ling Ji 2nd Season,,,
195,"The End of Awakening: Origins, The Invasion of Awakening",末世觉醒之溯源,,,,,['ONA'],26,Finished Airing,"Dec 22, 2020 to Jul 6, 2021",,,['Oriental Creative Color'],"None found,","None found,",Original,"['Action', 'Sci-Fi']",,,23 min. per ep.,PG-13 - Teens 13 or older,[],#17797,#17399,453,0,,No synopsis information has been added to this title. Help improve our database by adding a synopsis here.,"['Prequel (ONA) Moshi Juexing: Ruqin 2nd Season', '']",Moshi Juexing: Suyuan,,"['Mecha', 'Military']",
196,,白文鳥のしろ,Shiro the White Java Sparrow,,,,['ONA'],1,Finished Airing,"Nov 23, 2020",,,"None found,","None found,","None found,",Original,,,,4 min.,G - All Ages,6.22,#8745,#17586,442,0,218,No synopsis information has been added to this title. Help improve our database by adding a synopsis here.,[],Hakubunchou no Shiro,['Slice of Life'],,
197,"L.O.R.D: Legend of Ravaging Dynasties 2 - Coldblood Feast, Jue Ji 2: Lengxue Kuang Yan",冷血狂宴,,,,,['ONA'],1,Finished Airing,"Dec 4, 2020",,,"None found,","None found,","None found,",Original,"['Action', 'Fantasy']",,,2 hr. 9 min.,R - 17+ (violence & profanity),6.94,#4616,#17731,428,1,124,"Sequel film of Jue Ji, released online.","['Prequel (Movie) Jue Ji', '']",Lengxue Kuang Yan,,,
198,Dear My Patron Episode 0,おねがいっパトロンさま！「episode0」,Dear My Patron,,,,['ONA'],1,Finished Airing,"Oct 11, 2020",,,"None found,","None found,",['TANOsim'],Original,,,,16 min.,PG-13 - Teens 13 or older,[],#18206,#18308,388,0,,The encounter between Asahi and Ryouya.,"['Prequel (ONA) Onegai Patron-sama!', '']",Onegai Patron-sama! Episode 0,['Slice of Life'],,
199,Extinction Fear-shun.,ぜつめつきぐしゅんっ。,,,,,['ONA'],4,Finished Airing,"Dec 16, 2020",,,"None found,","None found,",['Geek Toys'],Original,,,['Kids'],6 min. per ep.,G - All Ages,[],#16085,#18303,388,1,,"The series follows the over 3,000 endangered species in the world. (Source: ANN)",[],Zetsumetsu Kigu-shun. (2020),,,
200,PQB,のポンチャオブース,,,,,['ONA'],22,Finished Airing,"Dec 2, 2020 to Jun 19, 2021",,,"None found,","None found,",['Bridge'],Other,,,,3 min. per ep.,PG-13 - Teens 13 or older,[],#18464,#18915,342,0,,"Anime uploaded to YouTube based on studio Bridge's original characters, Pont and Qiao.",[],Pont Qiao Booth,['Comedy'],,
201,,宿身小人,My Little Invisible Being,,,,['ONA'],12,Finished Airing,"Oct 5, 2020 to Dec 14, 2020",,,"None found,","None found,","None found,",Original,"['Comedy', 'Slice of Life']",,,5 min. per ep.,PG - Children,[],#14472,#19773,289,0,,"One day in 20XX, the alien pig prince who planned to take a human body as his home arrived on Earth, but unexpectedly discovered that the human being he wanted to live in had not yet been born! The pig prince, who has nowhere to settle down, got to know Saiji and Rubi. The three pulled various funny pranks on humans, causing humans to have baldness, bad breath, headaches, emotional crisis and other problems. (Source: bilibili, translated)",[],Su Shen Xiao Ren,,,
202,Fei Zhi Baike: Yuanlai Ni Shi Zheyang de Zhiwu,肥志百科,,,,,['ONA'],97,Finished Airing,"Oct 22, 2020 to Jun 24, 2023",,,"None found,","None found,","None found,",['Manga'],,,,6 min. per ep.,PG - Children,[],#20455,#20336,259,0,,No synopsis information has been added to this title. Help improve our database by adding a synopsis here.,[],Fei Zhi Baike,['Comedy'],,
203,,梦幻书院 第四季,,,,,['ONA'],14,Finished Airing,"Oct 12, 2020 to Jan 11, 2021",,,"None found,","None found,",['Painting Dream'],Game,"['Comedy', 'Fantasy']",,,2 min. per ep.,None,[],#17536,#20794,233,0,,Fourth season of Menghuan Shuyuan.,"['Prequel (ONA) Menghuan Shuyuan 3rd Season', 'Sequel (ONA) Menghuan Shuyuan: Kexue Xiao Jizhe']",Menghuan Shuyuan 4th Season,,,
204,,原石奇传前传--歌莉娅,,,,,['ONA'],1,Finished Airing,"Oct 14, 2020",,,"None found,","None found,","None found,",Original,"['Drama', 'Fantasy', 'Supernatural']",,,32 min.,PG-13 - Teens 13 or older,[],#15999,#21685,185,0,,"""If the dreams in our stories, always wake up"" ""Then let it..."" ""Make it a reality"" Yuan Shi Qi Zhuan Qianzhuan: Gloria is an animated short film made as a personal project. (Source: bilibili)",[],Yuan Shi Qi Zhuan Qianzhuan: Gloria,,,
205,Tianqi Ri,天启日,Apocalypse Day,,,,['ONA'],1,Finished Airing,"Oct 15, 2020",,,"None found,","None found,","None found,",Original,"['Action', 'Comedy', 'Sci-Fi']",['Super Power'],,19 min.,PG-13 - Teens 13 or older,[],#14719,#21687,184,1,,"Black Nest Technology, a giant enterprise headed by Xiao Sin, has almost conquered the world. It is rumored that their proud humanoid weapon ""Guardian"" has the power to destroy the world. However, not everyone accepts Xiao Sin's rule. The protagonist, Bai Jiu, successfully entered the Black Nest Technology with the help of his fellow rebels, trying to obtain a ""detector"" and recover everyone's life experience and family. And what purpose will the protector INK, who was sent to destroy the invaders, come here? (Source: bilibili)",[],Tian Qi Ri,,,
206,"History Cats 5th Season, When History Meows 5",如果历史是一群喵 第五季,,,,,['ONA'],13,Finished Airing,"Oct 11, 2020 to Dec 27, 2020",,,"None found,","None found,","None found,",['Web manga'],,['Historical'],['Kids'],7 min. per ep.,G - All Ages,[],#18808,#22098,164,0,,Fifth season of Ruguo Lishi Shi Yiqun Miao.,"['Prequel (ONA) Ruguo Lishi Shi Yiqun Miao 4th Season', 'Sequel (ONA) Ruguo Lishi Shi Yiqun Miao 6th Season']",Ruguo Lishi Shi Yiqun Miao 5th Season,['Comedy'],,
207,,BAD MOOD,,,,,['ONA'],4,Finished Airing,"Oct 20, 2020 to Nov 3, 2020",,,"None found,","None found,","None found,",Unknown,,['Music'],,17 min. per ep.,PG-13 - Teens 13 or older,[],#19253,#22354,152,0,,"The shorts follow The Pink Elephants, a fictional band with five members: Fishman, Butt, Rabbit, UFO, and Moth. The shorts depict the havoc in their daily lives. (Source: ANN)","['Prequel (ONA) Bad Mood Episode 0', '']",Bad Mood,['Comedy'],,
208,,ポンコツクエスト × モモウメ,,,,,['ONA'],1,Finished Airing,"Dec 1, 2020",,,"None found,","None found,","None found,",Other,"['Comedy', 'Fantasy']",,,4 min.,G - All Ages,[],#18459,#22319,155,0,,A collaboration between Ponkotsu Quest and Momoume.,[],Ponkotsu Quest x Momoume,,"['Parody', 'Workplace']",
209,,빙그레 크리스마스 캐롤송,,,,,['ONA'],1,Finished Airing,"Dec 14, 2020",,,"None found,","None found,",['STUDIOK110'],Mixed media,,['Music'],,1 min.,G - All Ages,[],#19489,#22653,142,0,,Musical Christmas video featuring Binggrae confectionery company characters.,[],Binggrae Christmas,['Comedy'],,
210,,プレパレ,Preparation,,,,['ONA'],3,Finished Airing,"Dec 14, 2020",,,['NHK Enterprises'],"None found,",['Oddjob'],Original,,['Educational'],,2 min. per ep.,G - All Ages,[],#18517,#22937,133,0,,"In this short animation, Luna, a girl who is uncomfortable with hospitals, medicine and injections, comes to understand the value of medicine via the thrilling explanations of a mysterious doctor. (Source: NHK World-Japan)",[],Prepare,,,
211,,HIMAWARIガールズ ミニアニメ,,,,,['ONA'],Unknown,Currently Airing,"Dec 28, 2020 to ?",,,"None found,","None found,","None found,",Original,,,['Kids'],3 min.,G - All Ages,[],#21086,#23708,112,0,,A mini anime series for Himawari Channel.,[],Himawari Girls Mini Anime,['Comedy'],,
212,Peeden,我是猪屁登,,,,,['ONA'],12,Finished Airing,"Dec 31, 2020 to ?",,,"None found,","None found,","None found,",Original,,['Anthropomorphic'],['Kids'],8 min. per ep.,PG - Children,[],#15216,#24424,99,0,,No synopsis information has been added to this title. Help improve our database by adding a synopsis here.,[],Wo Shi Zhu Pi Deng,,,
213,"TenSura OVA, That Time I Got Reincarnated as a Slime OVA, Tensei shitara Slime Datta Ken Gaiden, That Time I Got Reincarnated as a Slime Extra",転生したらスライムだった件 OVA,That Time I Got Reincarnated as a Slime OAD,That Time I Got Reincarnated As A Slim OAD,That Time I Got Reincarnated as a Slime OAD,"Moi, Quand Je Me Réincarne en Slime OAD",['OVA'],5,Finished Airing,"Jul 9, 2019 to Nov 27, 2020",,,"None found,","None found,",['8bit'],['Manga'],"['Action', 'Comedy', 'Fantasy']",,,23 min. per ep.,PG-13 - Teens 13 or older,7.48,#2029,#1033,"248,061",524,125081,"One day, Shuna and Shion are fighting over Rimuru's squishy slime body as usual. Rimuru figures that giving them each a body double of himself would solve the conflict, but when he imagines some of his other friends asking him to do the same for them, he quickly drops that plan. Then he comes up with the idea to make a cushion in the shape of his slime form. He travels around Tempest to see if his friends know of any good materials he can use, and he learns that a special type of sand found along a lake shore in the forest is exactly what he's looking for. So he sets out to collect some sand... but a monster is waiting for him by the lake! What's more, Milim hears about his plan for a picnic and comes racing down from the sky! (Source: Crunchyroll)",[],Tensei shitara Slime Datta Ken OVA,,"['Isekai', 'Reincarnation']",
214,Strike the Blood Fourth,ストライク・ザ・ブラッド IV,,,,,['OVA'],12,Finished Airing,"Apr 8, 2020 to Jun 30, 2021",,,"['Movic', 'Magic Capsule', 'Warner Bros. Japan', 'KlockWorx', 'Hakuhodo DY Music & Pictures', 'Kadokawa']","None found,",['Connect'],['Light novel'],"['Action', 'Fantasy', 'Ecchi']",,,25 min. per ep.,R+ - Mild Nudity,6.94,#4632,#2339,"91,343",184,27917,Fourth season of Strike the Blood.,"['Prequel (OVA) Strike the Blood III', 'Sequel (OVA) Strike the Blood Final', 'Adaptation (Manga) Strike the Blood', 'Adaptation (Light Novel) Strike the Blood']",Strike the Blood IV,,"['Harem', 'School', 'Urban Fantasy', 'Vampire']",
215,Fate/Grand Carnival: Dai-1 Tokuien Eirei Genkai Taisai Olympia,Fate/Grand Carnival 第一特異宴 英霊限界大祭オリンピア,Fate/Grand Carnival,,,,['OVA'],4,Finished Airing,"Dec 31, 2020 to Oct 13, 2021",,,"['Aniplex', 'Studio Hibari', 'Lantis', 'Notes', 'Good Smile Film', 'Delightworks']",['Aniplex of America'],['Lerche'],Game,"['Comedy', 'Fantasy']",['Parody'],,15 min. per ep.,PG-13 - Teens 13 or older,7.73,#1217,#3045,"58,328",243,23985,"The first episode of ""season"" one was pre-aired on the Fate Project New Year's Eve TV Special 2020 program.",[],Fate/Grand Carnival,,,
216,,クドわふたー,,,,,['OVA'],1,Finished Airing,"Nov 28, 2020",,,"None found,","None found,",['J.C.Staff'],Visual novel,"['Comedy', 'Romance']",['School'],,50 min.,PG-13 - Teens 13 or older,6.97,#4497,#5053,"20,681",42,4703,"Following an accident where Masato Inohara batted a baseball into the school's water main, the boys' dormitory is partially crippled. Until a plumber repairs the damage, the boys have to stay in the girls' dormitory. To determine which rooms they'll be assigned to, they draw tickets from a hat. Unfortunately, due to the limited capacity, some of the boys will have to go without a bed. Once Riki Naoe draws his ticket, he gets one that forces him to stay in one of the less-than-cozy clubrooms. Seeing his hapless predicament, a nervous Kudryavka ""Kud"" Noumi musters enough courage to confront her feelings while asking Riki to sleep in her room instead. Despite the rest of the Little Busters incessantly teasing Kud and Riki about their relationship, he stays with her throughout the summer. As they share unforgettable experiences one after another, the two realize that they might want to be more than just friends. [Written by MAL Rewrite]","['Adaptation (Manga) Kud Wafter', '']",Kud Wafter,,,
217,SUPER HXEROS OVA,ド級編隊エグゼロス,,,,,['OVA'],2,Finished Airing,"Nov 4, 2020 to Mar 4, 2021",,,"None found,","None found,",['Project No.9'],['Manga'],"['Action', 'Comedy', 'Sci-Fi', 'Ecchi']",,['Shounen'],23 min. per ep.,R+ - Mild Nudity,6.23,#8666,#5215,"19,133",32,7698,The first original video episode will follow three of the main heroines in an original story. Bundled with the 11th and 12th volumes of the Dokyuu Hentai HxEros manga. (Source: MAL News),[],Dokyuu Hentai HxEros OVA,,"['Harem', 'School']",
218,,おね→ショタ←おね THE ANIMATION,,,,,['OVA'],1,Finished Airing,"Nov 27, 2020",,,['Pink Pineapple'],"None found,",['Studio 1st'],Visual novel,,,,27 min.,Rx - Hentai,6.87,N/A,#6696,"10,125",72,4700,No synopsis information has been added to this title. Help improve our database by adding a synopsis here.,[],Oneshota The Animation,['Hentai'],,
219,,母ちゃんの友達にシコってるところ見られた。 THE ANIMATION,,,,,['OVA'],1,Finished Airing,"Oct 30, 2020",,,['Pink Pineapple'],"None found,",['Seven'],Visual novel,,,,27 min.,Rx - Hentai,6.96,N/A,#7319,"8,174",53,3933,The plot revolves around a boy whose mother left him with her friend to look after him or babysit him.,[],Kaa-chan no Tomodachi ni Shikotteru Tokoro Mirareta. The Animation,['Hentai'],,
220,,図書室ノ彼女～清楚ナ君ガ堕チルマデ～ THE ANIMATION,The Girl in the Library: Until the Pure You Falls from Grace,,,,['OVA'],6,Finished Airing,"Oct 30, 2020 to Sep 29, 2023",,,['Pink Pineapple'],"None found,","['Seven', 'Shion']",['Manga'],,,,17 min. per ep.,Rx - Hentai,5.96,N/A,#7362,"8,023",47,3158,No synopsis information has been added to this title. Help improve our database by adding a synopsis here.,[],Toshoshitsu no Kanojo: Seiso na Kimi ga Ochiru made - The Animation,['Hentai'],,
221,Knight of Erin: Erin and Nighthawk,Knight of Erin,,,,,['OVA'],4,Finished Airing,"Oct 30, 2020 to Mar 26, 2021",,,"None found,","None found,",['Majin'],Visual novel,"['Fantasy', 'Hentai']",,,16 min. per ep.,Rx - Hentai,6.62,N/A,#7373,"7,997",37,3578,No synopsis information has been added to this title. Help improve our database by adding a synopsis here.,[],Knight of Erin,,,
222,,悪の女幹部フルムーンナイトR,,,,,['OVA'],2,Finished Airing,"Oct 2, 2020 to Nov 6, 2020",,,['Lune-Pictures'],"None found,",['T-Rex'],Visual novel,,,,16 min. per ep.,Rx - Hentai,6.82,N/A,#7721,"7,099",18,3070,No synopsis information has been added to this title. Help improve our database by adding a synopsis here.,"['Prequel (OVA) Aku no Onna Kanbu: Full Moon Night', '']",Aku no Onna Kanbu: Full Moon Night R,['Hentai'],,
223,Tojitomo,刀使ノ巫女 刻みし一閃の燈火,Katana Maidens: Tomoshibi,,,,['OVA'],2,Finished Airing,"Oct 25, 2020 to Nov 29, 2020",,,"['Square Enix', 'Genco', 'Mainichi Broadcasting System', 'AT-X', 'Studio Gokumi', 'Crunchyroll', 'Kadokawa', 'My Theater D.D.']","None found,",['Project No.9'],Game,"['Action', 'Fantasy']",['Urban Fantasy'],,25 min. per ep.,PG-13 - Teens 13 or older,6.62,#6360,#8050,"6,405",13,2067,"Since ancient times, shrine maidens who wield swords have been exorcising ""aratama,"" strange existences that threaten the human world. These young women who wear school uniforms and a sword are called ""Toji,"" and they serve as an official unit within the police force as a ""special religious service police squad."" The government authorizes the Toji to wear swords and serve as government officials, and the government has set up five schools throughout the country for the girls to attend. In the spring, the five schools send their best Toji to compete in a tournament. As the tournament comes closer, all of the representatives rigorously train themselves in order to get stronger and improve their skills. (Source: ANN)","['Prequel (TV) Toji no Miko', '']",Toji no Miko: Kizamishi Issen no Tomoshibi,,,
224,,はじめてのおるすばん,,,,,['OVA'],2,Finished Airing,"Dec 4, 2020 to Mar 5, 2021",,,['Mary Jane'],"None found,",['BreakBottle'],Visual novel,,,,17 min. per ep.,Rx - Hentai,6.18,N/A,#8154,"6,210",28,2835,"On a cold winter's night, a man finds two girls—Saori and Shiori Mizuki—seemingly lost in front of his apartment. Since then, the twins have gradually become attached to him, with one staying at his place while the other is at school. However, the sisters' relationship with him is not merely that of a babysitter and child because sometimes more mature events occur. [Written by MAL Rewrite]","['Adaptation (Light Novel) Hajimete no Orusuban', '']",Hajimete no Orusuban,['Hentai'],,
225,You Can Do What You Please With Me In Her Place,実娘[あの子]の代わりに好きなだけ,,,,,['OVA'],2,Finished Airing,"Dec 18, 2020 to Feb 26, 2021",,,"['Queen Bee', 'Mediabank']","None found,",['Blue bread'],['Manga'],,,,20 min. per ep.,Rx - Hentai,6.60,N/A,#8201,"6,113",45,2854,"Her daughter found the perfect husband... muscular, tall, handsome, polite, always cheerful and has a huge bright smile with a similarly bright future ahead of him. While looking through some clothes that her daughter had left she found something a bit...revealing and after her husband came in and mistook her for her daughter, she found out he had not been getting the attention he needed so desperately... What is a mother to do? [Written by ShrSha]","['Adaptation (Manga) Ano Ko no Kawari ni Suki na Dake', '']",Ano Ko no Kawari ni Suki na Dake,['Hentai'],,
226,The Two Sides of the Honors Student Ayaka,優等生 綾香のウラオモテ,The Right Side and the Wrong Side of Honor Student Ayaka,,,,['OVA'],2,Finished Airing,"Oct 30, 2020 to Feb 5, 2021",,,['Mary Jane'],"None found,",['New Generation'],['Manga'],,,,15 min. per ep.,Rx - Hentai,6.65,N/A,#8228,"6,062",28,2346,No synopsis information has been added to this title. Help improve our database by adding a synopsis here.,[],Yuutousei Ayaka no Uraomote,['Hentai'],,
227,,シコやかなるときもハメるときも,,,,,['OVA'],2,Finished Airing,"Nov 20, 2020 to Jan 29, 2021",,,"['Queen Bee', 'Mediabank']","None found,",['Blue bread'],['Manga'],,,,19 min. per ep.,Rx - Hentai,6.36,N/A,#8253,"6,021",17,2121,No synopsis information has been added to this title. Help improve our database by adding a synopsis here.,"['Adaptation (Manga) Shikoyaka Naru Toki mo Hameru Toki mo', '']",Shikoyaka Naru Toki mo Hameru Toki mo,['Hentai'],,
228,,ホワイト ブルー,,,,,['OVA'],4,Finished Airing,"Nov 27, 2020 to Aug 27, 2021",,,"None found,","None found,",['PoRO'],Visual novel,,,,24 min. per ep.,Rx - Hentai,5.66,N/A,#8500,"5,655",25,1976,No synopsis information has been added to this title. Help improve our database by adding a synopsis here.,[],White Blue,['Hentai'],,
229,,対魔忍アサギ～捕らわれの肉人形～,Taimanin Asagi Spinoff Story,,,,['OVA'],1,Finished Airing,"Oct 30, 2020",,,['ZIZ Entertainment (ZIZ)'],"None found,",['Teatro Nishi Tokyo Studio'],Visual novel,"['Supernatural', 'Hentai']",['Mythology'],,18 min.,Rx - Hentai,6.15,N/A,#9615,"3,942",19,1594,No synopsis information has been added to this title. Help improve our database by adding a synopsis here.,[],Taimanin Asagi: Toraware no Niku Ningyou,,,
230,Sotsugyou Chikan Densha,卒業○○電車,,,,,['OVA'],4,Finished Airing,"Apr 24, 2020 to Oct 30, 2020",,,"None found,","None found,",['Suzuki Mirano'],['Manga'],,,,16 min. per ep.,Rx - Hentai,5.20,N/A,#9678,"3,874",5,1559,"Based on the doujin CG by Ibukichi. Bunta is a 43-year-old man who does nothing but think about his hot teacher from Nakajima Nanoka high school with whom he had a secret relationship. After years, she accidentally meets a woman who looks a lot like her old teacher named Nakajima Kanoko that she is a high school teacher with the same surname. Bunta falls madly in love with Kanoko and does not want to wait until the latter disappears like her former teacher.",[],Sotsugyou ** Densha,['Hentai'],,
