,Synonyms,Japanese,English,German,Spanish,French,Type,Episodes,Status,Aired,Premiered,Broadcast,Producers,Licensors,Studios,Source,Genres,Theme,Demographic,Duration,Rating,Score,Ranked,Popularity,Members,Favorites,Scorers,Synopsis,Related_Entries,Title,Genre,Themes,Demographics
81,,サザエさん,Mrs. Sazae,,,,['TV'],Unknown,Currently Airing,"Oct 5, 1969 to ?",['Fall 1969'],Sundays at 18:30 (JST),['Fuji TV'],"None found,",['Eiken'],['4-koma manga'],"['Comedy', 'Slice of Life']",,,24 min.,G - All Ages,6.14,#9123,#7117,"8,759",37,1931,"The main character is a mother named Sazae-san. She lives in a house with her husband, her kids and her parents. The show is the ultimate family program and tends to follow traditional themes. Think of this show as the Japanese equivalent to ""The Partridge Family"" and you'll get a good feel for this show's atmosphere. Don't expect to see things like violence, swearing, kung-fu action or magical girls. The plots are more like ""Today, Sazae-san goes to the new mall and gets lost"". Such ""boring"" plotlines and the simplistic art are often a turn-off to non-Japanese audiences, but most Japanese find the show incredibly good. As a result, it continues to be one of the top ratings grabbers on TV and is one of the few anime that is considered ""acceptable"" by adults. (Source: AniDB)","['Adaptation (Manga) Sazae-san', '']",Sazae-san,,,
82,,ミュークルドリーミー,,,,,['TV'],48,Finished Airing,"Apr 5, 2020 to Apr 4, 2021",['Spring 2020'],Sundays at 10:30 (JST),['Sanrio'],"None found,",['J.C.Staff'],Other,"['Adventure', 'Fantasy']",,['Kids'],24 min. per ep.,G - All Ages,7.00,#4381,#7123,"8,729",31,1879,"The story begins when a middle school girl named Yume sees something fall from the sky, and meets a pale violet-colored kitten named Mew. It turns out that Mew has the power of ""Yume Synchro"" (Dream Synchro), the power to enter dreams. In the dream world, the girl and Mew collect Dream Stones. (Source: ANN)","['Sequel (TV) Mewkledreamy Mix!', '']",Mewkledreamy,,,
83,"Ninja Boy Rantaro, Rakudaii Nintama Rantarou",忍たま乱太郎,,,El Ninja Boy Rantaró,,['TV'],Unknown,Currently Airing,"Apr 10, 1993 to ?",['Spring 1993'],Not scheduled once per week,"['NHK', 'Sogo Vision', 'NHK Enterprises']","None found,","['Ajia-do', 'Gakken']",['Manga'],,,['Kids'],10 min.,G - All Ages,7.07,#4072,#7378,"7,969",77,2546,"Taking place in the Sengoku Period, Rantarou, Kirimaru and Shinbei are young students at Ninjutsu Academy, a school that teaches all kinds of youth how to become ninjas. Known as ""Nintamas"" (a contraction of ninja + tama [egg]), the main trio, and many other students at the school, must learn all sorts of unique skills to achieve their goal. Unfortunately, things aren't that simple, since our protagonists constantly find themselves failing their classes. With strict ninja teachers such as Doi-sensei and Yamada-sensei, the mischievous girls from the Kunoichi class, an entire crew of pirates and dozens more interesting characters, anything can happen in the crazy world of Nintama. The episodes are 7 minutes and thirty seconds long each, and each season (which there's currently 29 of) usually has a range of 60-90 episodes.","['Adaptation (Manga) Rakudai Ninja Rantarou', '']",Nintama Rantarou,['Comedy'],,
84,Maruko-chan,ちびまる子ちゃん,Little Miss Maruko,,Chibi Maruko-chan,,['TV'],Unknown,Currently Airing,"Jan 8, 1995 to ?",['Winter 1995'],Sundays at 18:00 (JST),"['Ajia-do', 'Fuji TV', 'Sakura Production']","None found,",['Nippon Animation'],['Manga'],,['School'],['Shoujo'],23 min.,G - All Ages,7.34,#2629,#7918,"6,700",61,2165,"Momoko Sakura is an elementary school student who likes popular idol Momoe Yamaguchi and mangas. She is often called ""Chibi Maruko-chan"" due to her young age and small size. She lives together with her parents, her grandparents and her elder sister in a little town. In school, she has many friends with whom she studies and plays together everyday, including her close pal, Tama-chan; the student committee members, Maruo-kun and Migiwa-san; and the B-class trio: 'little master' Hanawa-kun, Hamaji-Bu Taro and Sekiguchi-kun. This is a fun-loving and enjoyable anime that portrays the simple things in life. (Source: ANN)","['Prequel (TV) Chibi Maruko-chan', 'Adaptation (Manga) Chibi Maruko-chan']",Chibi Maruko-chan (1995),['Comedy'],,
85,Cardfight!! Vanguard Extra Story,カードファイト!! ヴァンガード外伝 イフ-if-,,Cardfight!! Vanguard Extra Story -if-,Cardfight!! Vanguard Extra Story: if,Cardfight!! Vanguard Extra Story -if-,['TV'],25,Finished Airing,"May 30, 2020 to Nov 28, 2020",['Spring 2020'],Saturdays at 08:00 (JST),"None found,","None found,",['OLM'],Original,"['Action', 'Adventure', 'Comedy']",,,24 min. per ep.,PG-13 - Teens 13 or older,6.48,#7174,#9118,"4,643",12,1682,"Upon the conclusion of the Vanguard High School Koshien, Kouji Ibuki begins to have new nightmares. Nome Tatsunagi has Suiko summon him to the mansion where they learn he can see a Dark Tower called Sanctuary. Sanctuary is causing the timeline to be altered throughout history, and the only way to correct it is for Kouji to first correct his future mistake. Now Kouji and Suiko must travel the parallel world -if- and watch as Magical Girls Emi Sendou and Shuka summon Vanguard units to help correct history. Sadly, the two can't help much, as Cardfighting against real monsters doesn't do much good. (Source: ANN)",[],Cardfight!! Vanguard Gaiden: If,,"['Mythology', 'Parody', 'Strategy Game']",
86,"Soreike! Anpanman, Go! Anpanman, Anpanman TV",それいけ！アンパンマン,,,,,['TV'],Unknown,Currently Airing,"Oct 3, 1988 to ?",['Fall 1988'],Fridays at 16:20 (JST),"['Sotsu', 'Nippon Television Network']","None found,",['TMS Entertainment'],Picture book,"['Comedy', 'Fantasy']",,['Kids'],24 min.,PG - Children,6.58,#6581,#9161,"4,581",31,1735,"One night, a Star of Life falls down the chimney of a bakery nestled deep in the forest, causing the dough in the oven to come to life. The dough becomes Anpanman, a superhero made of anpan (a sweet roll with bean jam filling). Together with his friends, Anpanman fights his rival Baikinman and helps the malnourished. (Source: ANN)",[],Sore Ike! Anpanman,,,
87,,りばあす,,,,,['TV'],48,Finished Airing,"Jan 5, 2020 to Jun 23, 2021",['Winter 2020'],Wednesdays at 01:00 (JST),['LIDENFILMS'],"None found,",['LIDENFILMS Osaka Studio'],Card game,,['Strategy Game'],,3 min. per ep.,PG-13 - Teens 13 or older,5.83,#10761,#9172,"4,569",3,933,The series revolve around a team of 12 high school students who love to play the trading card game Rebirth For You. (Source: ANN),[],Rebirth,['Comedy'],,
88,,爆丸アーマードアライアンス,,,,,['TV'],52,Finished Airing,"Apr 3, 2020 to Mar 26, 2021",['Spring 2020'],Fridays at 03:04 (JST),"None found,","None found,",['TMS Entertainment'],Original,"['Action', 'Fantasy']",['Strategy Game'],,24 min. per ep.,PG - Children,5.70,#11340,#9212,"4,508",6,1700,Second season of Bakugan: Battle Planet.,"['Prequel (TV) Bakugan: Battle Planet', 'Sequel (ONA) Bakugan: Geogan Rising']",Bakugan: Armored Alliance,,,
89,,ぼのぼの,Bono Bono,Bono Bono,Bono Bono,Bono Bono,['TV'],Unknown,Currently Airing,"Apr 2, 2016 to ?",['Spring 2016'],Saturdays at 04:52 (JST),"['Fuji TV', 'Glovision']","None found,",['Eiken'],['4-koma manga'],"['Comedy', 'Slice of Life']",['Anthropomorphic'],,5 min.,G - All Ages,6.37,#7868,#10210,"3,265",19,757,"Based on the original comic BONO BONO by Mikio Igarashi that has seen over 9,000,000 total copies printed, this is the definitive animated version of the emotionally soothing character-driven series that will make you ask yourself the philosophical question, ""What are living things?"" while laughing at heartwarming gags and being entertained by the interactions of amusing forest friends Bonobono the young sea otter, Chipmunk, Fishing Cat, and more. Enjoy the easygoing days and minor misadventures of Bonobono and his friends! (Source: Fuji Creative)","['Adaptation (Manga) Bonobono', 'Adaptation (Manga) Bono-chan']",Bonobono (TV 2016),,,
90,Kiratto Pri☆chan 3rd Season,キラッとプリ☆チャン シーズン3,,,,,['TV'],51,Finished Airing,"Apr 5, 2020 to May 30, 2021",['Spring 2020'],Sundays at 10:00 (JST),['syn Sophia'],"None found,",['Tatsunoko Production'],Game,,,,24 min. per ep.,PG - Children,7.23,#3206,#10516,"2,982",11,968,Third season of Kiratto Pri☆chan.,"['Prequel (TV) Kiratto Pri☆chan Season 2', '']",Kiratto Pri☆chan Season 3,['Comedy'],"['Idols (Female)', 'Music']",
91,,ガル学. ~聖ガールズスクエア学院~,,,,,['TV'],50,Finished Airing,"Apr 6, 2020 to Mar 29, 2021",['Spring 2020'],Mondays at 07:05 (JST),"None found,","None found,","['OLM', 'Wit Studio']",Mixed media,,,,3 min. per ep.,PG-13 - Teens 13 or older,5.62,#11714,#11110,"2,491",5,437,"The anime is set in Holy Girls Square Academy, an academy for training pro star performers. The anime will focus on students who aim to participate in the academy's annual big event, the Girls' Arena. (Source: ANN)","['Sequel (TV) Garugaku. II: Lucky Stars', 'Adaptation (Manga) Gal-gaku.']",Garugaku.: Sei Girls Square Gakuin,,"['Idols (Female)', 'Music', 'School']",
92,,おじゃる丸,Prince Mackaroo,,,,['TV'],Unknown,Currently Airing,"Oct 5, 1998 to ?",['Fall 1998'],Not scheduled once per week,['NHK'],['Enoki Films'],['Gallop'],Original,"['Adventure', 'Award Winning', 'Comedy', 'Fantasy']",,['Kids'],10 min.,G - All Ages,6.39,#7742,#11523,"2,215",5,553,"In the Heian era, around 1000 years ago, a young boy of noble family named Ojarumaru is bored with his life of privilege. Meanwhile, three demons steal the power-stick of Enma, king of demons, and then lose it. Ojarumaru finds it, and uses it to transport himself to the present time. Here, he is befriended by a young boy named Kazuma, and becomes a member of his family. As time goes on, Ojarumaru makes many new friends, while dodging the comedic efforts of the three demons, Akane, Kisuke, and Aobee, as they try to recover the stick. (from ANN)","['Adaptation (Manga) Ojarumaru', '']",Ojarumaru,,,
93,"Yokai Watch Jam: Yokai Academy Y, Y School Heroes",妖怪ウォッチJam 妖怪学園Y Nとの遭遇,Yo-kai Watch Jam: Yo-kai Academy Y,,,,['TV'],63,Finished Airing,"Dec 27, 2019 to Apr 2, 2021",['Winter 2020'],Fridays at 18:25 (JST),"None found,","None found,",['OLM'],Game,"['Comedy', 'Supernatural']",,['Kids'],24 min. per ep.,PG - Children,6.40,#7694,#11678,"2,116",11,428,,"['Prequel (Movie) Youkai Watch Movie 6: Youkai Gakuen Y - Neko wa Hero ni Nareru ka', '']",Youkai Watch Jam: Youkai Gakuen Y - N to no Souguu,,"['Mythology', 'School']",
94,PazuDora,パズドラ,Puzzle & Dragon,,,,['TV'],Unknown,Currently Airing,"Apr 2, 2018 to ?",['Spring 2018'],Mondays at 18:25 (JST),['Akatsuki'],"None found,",['Pierrot'],Game,,['Strategy Game'],['Kids'],24 min.,PG - Children,5.84,#10734,#12351,"1,689",6,147,"The story is set in modern day Japan following the growth of the protagonist Taiga Akashi, an elementary school kid who wants to be a professional gamer someday. (Source: Crunchyroll)",[],Puzzle & Dragon,,,
95,"Tomica Bond Combination Earth Granner, Tomika Kizuna Gattai",トミカ絆合体 アースグランナー,,,,,['TV'],51,Finished Airing,"Apr 5, 2020 to Mar 28, 2021",['Spring 2020'],Sundays at 09:30 (JST),"None found,","None found,",['OLM'],Other,"['Action', 'Adventure', 'Sci-Fi']",['Mecha'],,24 min. per ep.,PG - Children,5.91,#10406,#12493,"1,622",2,272,"Earth Energy is a force generated naturally by the Earth's rotation. A mysterious alien enemy from space known as ""Dark Spinner"" has invaded Earth in order to steal the Earth Energy and transform it into Dark Energy. The only ones who can stand up to stop them are twin brothers named Raiga and Kuga, who are fighting together with the earth defense team Earth Granner. But will they be able to protect the earth? (Source: Tomica Wiki)",[],Tomica Kizuna Gattai: Earth Granner,,,
96,Kamiusagi Rope 4,紙兎ロペ 〜笑う朝には福来たるってマジっすか!?,,,,,['TV'],Unknown,Currently Airing,"Nov 16, 2012 to ?",['Fall 2012'],Not scheduled once per week,"None found,","None found,","None found,",Original,"['Comedy', 'Slice of Life']",,,2 min.,G - All Ages,[],#16658,#13269,"1,281",0,,"Fourth season of Kamiusagi Rope, events occur after the feature film. Airs on Mezamashi TV instead of the theaters.","['Prequel (Movie) Kamiusagi Rope tsuka, Natsuyasumi Rasuichi tte Maji ssuka!?', '']",Kamiusagi Rope: Warau Asa ni wa Fukuraitaru tte Maji ssuka!?,,,
97,,もっと! まじめにふまじめ かいけつゾロリ,,,,,['TV'],25,Finished Airing,"Apr 5, 2020 to Nov 8, 2020",['Spring 2020'],Sundays at 19:00 (JST),"None found,","None found,","['Ajia-do', 'Bandai Namco Pictures']",Book,"['Adventure', 'Comedy']",,['Kids'],25 min. per ep.,PG - Children,6.47,#7293,#13824,"1,099",2,195,No synopsis information has been added to this title. Help improve our database by adding a synopsis here.,"['Prequel (TV) Majime ni Fumajime Kaiketsu Zorori', 'Sequel (TV) Motto! Majime ni Fumajime Kaiketsu Zorori 2nd Season']",Motto! Majime ni Fumajime Kaiketsu Zorori,,,
98,,DUEL MASTERS キング,,,,,['TV'],47,Finished Airing,"Apr 5, 2020 to Mar 28, 2021",['Spring 2020'],Sundays at 08:30 (JST),"None found,","None found,","[""Brain's Base"", 'Shogakukan Music & Digital Entertainment']",Original,"['Action', 'Adventure', 'Comedy', 'Fantasy']",,['Kids'],24 min. per ep.,G - All Ages,5.79,#10953,#13993,"1,058",1,173,No synopsis information has been added to this title. Help improve our database by adding a synopsis here.,"['Prequel (TV) Duel Masters!!', 'Sequel (TV) Duel Masters King!']",Duel Masters King,,,
99,Hana Kappa,はなかっぱ,,,,,['TV'],Unknown,Currently Airing,"Mar 29, 2010 to ?",['Spring 2010'],Not scheduled once per week,"['Group TAC', 'TOHO animation']","None found,","['Xebec', 'OLM']",Picture book,,,['Kids'],10 min.,PG - Children,6.00,#9903,#14211,996,0,170,Story about Kappa with flowers on their heads.,[],Hanakappa,['Comedy'],,
100,,しあわせ配達おみくじタネコ,,,,,['TV'],Unknown,Currently Airing,"Mar 26, 2011 to ?",['Spring 2011'],Not scheduled once per week,"None found,","None found,",['Kachidoki Studio'],Original,,,,Unknown,None,[],#14075,#14275,976,4,,"The story centers around a cat who answers people's wishes and delivers happiness. (""Tane"" and ""neko"" are the Japanese words for ""seed"" and ""cat,"" respectively.) (Source: ANN)",[],Shiawase Haitatsu Taneko,['Comedy'],,
101,"In the Other World, Ghost Groups Are Everything!","あの世のすべては, おばけぐみっ!",,,,,['TV'],34,Finished Airing,"Apr 7, 2020 to Dec 29, 2020",['Spring 2020'],Unknown,['Stella Promotion'],"None found,","None found,",Original,"['Comedy', 'Supernatural']",,,4 min. per ep.,PG-13 - Teens 13 or older,[],#19132,#14348,954,1,,"The gag anime takes place at a school for youkai and other supernatural beings. A vampire named Rakuru transfers to the school from the West, and she tries to change the school as the class representative.",[],"Anoyo no Subete wa, Obake-gumi!",,,
102,Ahare! Meisaku-kun,あはれ! 名作くん,Aware! Meisaku-kun,,,,['TV'],230,Finished Airing,"Apr 8, 2016 to Mar 4, 2022",['Spring 2016'],Fridays at 18:20 (JST),"None found,","None found,",['Pie in the sky'],Original,,,['Kids'],5 min. per ep.,G - All Ages,6.11,#9313,#14385,942,1,209,"A long, long time ago, there was a prestigious school called ""Ryuuguu Elementary School"" that produced many masterpiece characters. One day, an ordinary boy named Meisaku Matsuda enrolled at the school. Little did he know that the place for learning was filled with crazy characters like Sweets, the energetic idiot; Musubi, a rice ball who gets angry when called ""onigiri""; Nokio, a narcissistic self-proclaimed robot; and Bolt, who's clearly faster than a rabbit. Surrounded by such unique characters, will Meisaku be able to graduate as a splendid masterpiece character? (Source: Anime News Network)",[],Aware! Meisaku-kun,['Comedy'],"['Parody', 'School']",
103,,おばけずかん,,,,,['TV'],39,Finished Airing,"Jul 1, 2020 to Mar 31, 2021",['Summer 2020'],Wednesdays at 07:20 (JST),"None found,","None found,",['Fanworks'],Picture book,"['Comedy', 'Fantasy', 'Supernatural']",['Mythology'],['Kids'],2 min. per ep.,PG - Children,5.71,#11293,#14818,838,1,190,The Obake Zukan series illustrates various monsters and spirits and explains why they are scary. (Source: ANN),"['Sequel (TV) Obake Zukan!', '']",Obake Zukan,,,
104,,ゾゾゾ ゾンビーくん,Zo Zo Zombie,Zo Zo Zombie,Zo Zo Zombie,Zo Zo Zombie,['TV'],102,Finished Airing,"Apr 16, 2020 to Dec 24, 2020",['Spring 2020'],Unknown,['Shogakukan-Shueisha Productions'],"None found,",['J.C.Staff'],['Manga'],,,['Kids'],3 min. per ep.,PG - Children,[],#16249,#15173,751,2,,"A gag comedy aimed at young children featuring Zombie-kun, a child zombie, and his interactions with the world. It's not intended to be scary in the slightest, but rather, it focuses on the comical and bizarre things Zombie-kun's body can do, and the common-sense-defying way Zombie-kun behaves. For example, he'll take out his stomach and inflate it with air to use as a pillow, or if he gets wet, he'll detach parts of his body and wring them out like towels, then reattach them with a glue stick. Everything is depicted in a cute, cartoony fashion so as not to be too graphic for kids. (Source: Baka-Updates)","['Adaptation (Manga) Zo Zo Zo Zombie-kun', '']",Zo Zo Zo Zombie-kun (TV),['Comedy'],,
105,,まるまるマヌル,,,,,['TV'],50,Finished Airing,"Jan 6, 2020 to Dec 15, 2020",['Winter 2020'],Mondays at 00:30 (JST),"None found,","None found,",['Kachidoki Studio'],['Web manga'],,,,1 min. per ep.,G - All Ages,[],#17424,#15324,717,0,,"The comedy story follows the daily life of a somewhat flippant Pallas's cat or manul named Manul-kun, an orange tabby cat named Chatora-kun, Sukofu-kun, and other cats. (Source: ANN)",[],Marumaru Manul,['Comedy'],,
106,,しまじろうのわお!,,,,,['TV'],Unknown,Currently Airing,"Apr 2, 2012 to ?",['Spring 2012'],Mondays at 07:30 (JST),"None found,","None found,",['The Answer Studio'],Other,"['Adventure', 'Comedy', 'Fantasy']",,['Kids'],8 min.,G - All Ages,[],#14107,#15530,682,1,,Fourth season of the Shimajirou children's television series.,"['Prequel (TV) Shimajirou Hesoka', '']",Shimajirou no Wow!,,,
107,,マヌ～ルのゆうべ,,,,,['TV'],Unknown,Currently Airing,"Nov 11, 2018 to ?",['Fall 2018'],Sundays at Unknown,['NHK'],"None found,","None found,",['Web manga'],,,,1 min.,PG-13 - Teens 13 or older,[],#17389,#15745,648,1,,"Within the nature ""Darwin Kita! Kikimono Shin Densetsu"" program on NHK1.5 airs the short Manul no Yuube, based on a web manga/comic of the same name. It following animal characters who visit the bar Manul no Yuube. The bar is run by the Mama who is a Pallas's cat (Otocolobus manul) and serviced by the hostess Tsunomin who is a Brazilian treehopper (Bocydium globulare).",[],Manul no Yuube,['Slice of Life'],,
108,,캐치! 티니핑,Catch! Teenieping: Fairies of Emotion,,,,['TV'],52,Finished Airing,"Mar 19, 2020 to Apr 1, 2021",['Spring 2020'],Unknown,"None found,","None found,",['SAMG Entertainment'],Original,,,['Kids'],11 min. per ep.,PG - Children,6.24,#8592,#16259,573,4,145,"Catch! Teenieping revolves around mischievous creatures called Teenieping that like to enter people's minds, but their playful nature and magical powers can wreak havoc in their hosts' lives. When the Teenieping are set loose on Earth, Princess Romi of the Emotion Kingdom becomes an ordinary girl that has to turn into a magical girl to stop them, all while balancing her new civilian life as a worker for the Bakery Heartrose with her coworkers Ian, Kyle, and Jun. (Source: Wikipedia)","['Sequel (TV) Banjjagbanjjag Catch! Tiniping', '']",Catch! Tiniping,['Fantasy'],"['Mahou Shoujo', 'School']",
109,Rice Monster Pap,ごはんかいじゅうパップ,,,,,['TV'],Unknown,Currently Airing,"Apr 25, 2011 to ?",['Spring 2011'],Not scheduled once per week,"None found,","None found,",['DLE'],Original,"['Action', 'Comedy']",,['Kids'],30 sec.,G - All Ages,[],#20724,#16384,561,0,,"A series of short, 30-second segments featuring Gohan Kaijuu Pap and various ""side dish"" monsters to produce delicious meals.",[],Gohan Kaijuu Pap,,,
110,Yowamon,よわむしモンスターズ,,,,,['TV'],Unknown,Currently Airing,"Dec 25, 2012 to ?",['Winter 2013'],Not scheduled once per week,['NHK'],"None found,","None found,",Original,,,['Kids'],1 min.,PG - Children,[],#15983,#16702,523,0,,An NHK toddler's anime following cowardly creatures representing typical Halloween monsters like Dracula and a witch.,[],Yowamushi Monsters,,,
111,,のりものまん モービルランドのカークン,,,,,['TV'],104,Finished Airing,"Apr 2, 2020 to Mar 24, 2022",['Spring 2020'],Thursdays at 17:20 (JST),"None found,","None found,",['CloverWorks'],Original,,['Racing'],['Kids'],5 min. per ep.,PG - Children,[],#18109,#16779,517,0,,"The anime will depict various vehicles as characters in the ""Mobile Land"" island. The protagonist Car-kun arrives at the island as a delivery worker. Through his deliveries, he gets to know the residents of Mobile Land, all while following traffic rules and having his deliveries stopped by the meddling Sabibi. (Source: ANN)",[],Norimono Man: Mobile Land no Car-kun,['Comedy'],,
112,Meow Meow Japanese History,ねこねこ日本史 第5期,,,,,['TV'],32,Finished Airing,"Apr 8, 2020 to Mar 3, 2021",['Spring 2020'],Wednesdays at 06:45 (JST),['NHK'],"None found,","None found,",['Web manga'],,,['Kids'],9 min. per ep.,G - All Ages,[],#17979,#17137,481,0,,Fifth season of Neko Neko Nihonshi.,"['Prequel (TV) Neko Neko Nihonshi 4th Season', 'Adaptation (Manga) Neko Neko Nihonshi']",Neko Neko Nihonshi 5th Season,,"['Anthropomorphic', 'Historical', 'Parody', 'Samurai']",
113,,えほん寄席,,,,,['TV'],73,Finished Airing,"Apr 2006 to Nov 11, 2023",['Spring 2006'],Unknown,"['NHK', 'Pony Canyon']","None found,","None found,",Other,,,['Kids'],5 min. per ep.,PG - Children,[],#20385,#17172,478,0,,Anime rakugo of classic Japanese horror tales shown in a wide variety of art styles.,[],Ehon Yose,['Horror'],"['Historical', 'Performing Arts']",
114,,바이트 초이카,Bite-Choicar,,,,['TV'],26,Finished Airing,"Apr 18, 2020 to May 23, 2021",['Spring 2020'],Saturdays at 07:15 (JST),"None found,","None found,","None found,",Original,,['Racing'],['Kids'],30 min. per ep.,PG - Children,[],#19501,#17305,464,2,,"Chashin was selected by the legendary choicar ""Stormbone,"" as the strongest racer, and will showcase a new concept of bite racing. Bite racing is a new racing game that never hits a rail with two cars chasing in a match. The bite-free rail running on the track creates a more realistic racing experience. Various types of super cars such as speed type, balance type, and power type create unique racing on 3 types of tracks (crash track, line track, outdoor race). (Source: enewstoday.co.kr)","['Sequel (TV) Bite-Choicar Hyper', '']",Bite-Choicar,,,
115,,耐え子の日常,,,,,['TV'],132,Finished Airing,"Jul 1, 2020 to Dec 31, 2020",['Summer 2020'],Not scheduled once per week,"None found,","None found,",['DLE'],['Manga'],,['Workplace'],,1 min. per ep.,G - All Ages,[],#14539,#17502,448,1,,Sequel of Taeko no Nichijou.,"['Prequel (TV) Taeko no Nichijou', '']",Taeko no Nichijou 2nd Season,['Slice of Life'],,
116,,オトッペ,,,,,['TV'],265,Finished Airing,"Apr 3, 2017 to Mar 31, 2023",['Spring 2017'],Mondays at 08:40 (JST),['NHK'],"None found,","None found,",Original,,['Music'],['Kids'],3 min. per ep.,G - All Ages,[],#18281,#17733,429,0,,"The series follows a young girl named Shina who hopes to become the world's best DJ, and is interested in new sounds. Shina explores a mysterious world filled with Otoppe, strange creatures capable of unique sounds.",[],Otoppe,['Fantasy'],,
117,Pokkories,ぽっこりーず,Poccolies,,,,['TV'],50,Finished Airing,"Apr 6, 2020 to Mar 15, 2021",['Spring 2020'],Mondays at 23:29 (JST),"None found,","None found,",['Kachidoki Studio'],Other,,,['Kids'],1 min. per ep.,G - All Ages,[],#18444,#18014,410,1,,"The 2018 LINE sticker set Poccolies is inspiring a series of anime shorts. The story of the sticker set is that a positive and honest boy named Patsuhiko lives on Pokkori Island, along with the shrewd and mysterious Ham, and a reliable older brother figure named Kangaroo. The sticker set follows their daily lives. (Source: ANN)",[],Poccolies,['Slice of Life'],,
118,,パッコロリン,Pakkororin,,,,['TV'],Unknown,Currently Airing,"Mar 28, 2011 to ?",['Spring 2011'],Not scheduled once per week,['NHK'],"None found,",['Three-d'],Original,,,['Kids'],1 min.,G - All Ages,[],#18309,#18233,393,0,,"A minute long children's anime that follows 3 siblings. Two brothers who are rectangular and circular shaped, and a sister who is triangluar shaped. They have unique personalities and foster growth and discovery through their play time.",[],Pakkororin,,,
119,"Shin Nippon History: Minna ga Shiranai, Atarashii Nihon no Rekishi.",新ニッポンヒストリー,,,,,['TV'],Unknown,Currently Airing,"Jan 6, 2020 to ?",['Winter 2020'],Mondays at 01:00 (JST),"None found,","None found,","None found,",Original,,['Historical'],,23 min.,G - All Ages,[],#14130,#18536,369,0,,No synopsis information has been added to this title. Help improve our database by adding a synopsis here.,[],Shin Nippon History,['Comedy'],,
